group,n,BLIP_acc,BLIP_n,ViLT_acc,ViLT_n
S1 Open-ended retrieval (query),68167,0.4274502325172004,68167,0.40829140199803426,68167
S2 Binary perception (verify + logical),43509,0.6600013790250293,43509,0.6290192833666598,43509
S3 Constrained choice (choose + compare),20386,0.589424114588443,20386,0.5332090650446385,20386
V1 Relational/spatial (rel),61634,0.4808709478534575,61634,0.46068728299315315,61634
V2 Attribute recognition (attr),42201,0.5784697045093719,42201,0.5420724627378498,42201
V3 Object detection (obj),15564,0.5642508352608584,15564,0.5357877152402981,15564
V4 Categorization (cat),8616,0.5525766016713092,8616,0.5013927576601671,8616
V5 Scene understanding (global),4047,0.5626389918458117,4047,0.5290338522362243,4047
